[
  {
    "aanbieder_agb": "12345678",
    "locatie_id": "LOC-001",
    "peildatum": "2026-03-23",
    "frequentie": "week",
    "totale_capaciteit": 24,
    "bezette_plekken": 21,
    "beschikbare_plekken": 3,
    "wachtlijst_aantal": 5,
    "gemiddelde_wachttijd_dagen": 42,
    "type_verblijf": "RES",
    "zorgzwaarte": "ZZ2",
    "opmerkingen": null
  },
  {
    "aanbieder_agb": "12345678",
    "locatie_id": "LOC-002",
    "peildatum": "2026-03-23",
    "frequentie": "week",
    "totale_capaciteit": 8,
    "bezette_plekken": 8,
    "beschikbare_plekken": 0,
    "wachtlijst_aantal": 3,
    "gemiddelde_wachttijd_dagen": 28,
    "type_verblijf": "GZH",
    "zorgzwaarte": "ZZ1",
    "opmerkingen": "Eén plek komt vrij per 1 april"
  },
  {
    "aanbieder_agb": "87654321",
    "locatie_id": "LOC-010",
    "peildatum": "2026-03-23",
    "frequentie": "week",
    "totale_capaciteit": 6,
    "bezette_plekken": 4,
    "beschikbare_plekken": 2,
    "wachtlijst_aantal": 0,
    "gemiddelde_wachttijd_dagen": null,
    "type_verblijf": "CRS",
    "zorgzwaarte": "ZZ3",
    "opmerkingen": "Crisisplekken, beschikbaarheid kan per dag wisselen"
  }
]
